{
"format": "2.0",
"id": "STYLE100_SIDE/Crouched_SideRight",
"name": "Crouched_SideRight",
"legend": "2.0",
"dur": 1.167,
"loop": true,
"fps": 30,
"tags": ["sidestep","right","style"],
"desc": "Sidestepping to the right, crouched style: squat slightly and bend back",
"skeleton": "humanoid",
"restSrc": "100STYLE",
"contacts": {"by":"detected","footL":[[1.068,1.857]],"footR":[[0.46,1.167]]},
"facts": {"by":"m3a-facts@1","captured":["speed"],"height":[91,97],"seam":0,"speed":60,"travel":[6.7,67.7]},
"provenance": {"src":"100STYLE","take":"Crouched_SW 81.92-83.10","method":"captured","producer":{"tool":"m3a-import","version":"1"},"license":"CC-BY-4.0","credit":"100STYLE, Mason, Starke and Komura (CC BY 4.0)","ai":"digitalCapture"},
"quality": {"fit":[9,31],"qa":"pass","qaVersion":"m3a-sensors@1"},
"keys": [
  {"t":0,
   "hips":[0,0,95], "body":[0,7,-4], "chest":[-3,28,2], "head":[-1,-3,2],
   "shL":[6,-8], "shR":[7,-9], "armL":[34,13,-93,17,15], "armR":[38,10,-92,13,-7], "handL":[-9,-6,133], "handR":[-14,-7,127], "fingersL":[0,0,0,0,0], "fingersR":[0,0,0,0,0],
   "legL":[15,3,-99,43,1], "legR":[17,-11,-98,45,-9], "footL":[-7,8,0], "footR":[-4,-8,0]},
  {"t":0.133,
   "hips":[-1,-4,97], "body":[3,7,-7], "chest":[-4,28,2], "head":[-1,-2,2],
   "shL":[7,-8], "shR":[6,-9], "armL":[35,13,-93,17,13], "armR":[35,12,-93,13,-3], "handL":[-6,-7,131], "handR":[-13,-7,125], "fingersL":[0,0,0,0,0], "fingersR":[0,0,0,0,0],
   "legL":[15,12,-98,38,1], "legR":[22,-11,-97,54,-15], "footL":[-8,12,0], "footR":[1,-21,-2]},
  {"t":0.333,
   "hips":[0,-6,96], "body":[1,6,-7], "chest":[-4,27,5], "head":[0,-1,2],
   "shL":[7,-7], "shR":[5,-9], "armL":[37,14,-92,24,8], "armR":[27,19,-95,15,-28], "handL":[-6,-8,125], "handR":[-8,-8,146], "fingersL":[0,0,0,0,0], "fingersR":[0,0,0,0,0],
   "legL":[11,24,-96,41,2], "legR":[21,19,-96,46,5], "footL":[-7,10,0], "footR":[6,22,0]},
  {"t":0.433,
   "hips":[1,-6,93], "body":[-2,6,-5], "chest":[-2,27,6], "head":[1,-2,1],
   "shL":[6,-7], "shR":[6,-9], "armL":[39,17,-91,27,18], "armR":[24,23,-94,11,-22], "handL":[-6,-8,131], "handR":[-10,-7,138], "fingersL":[0,0,0,0,0], "fingersR":[1,1,1,1,1],
   "legL":[10,28,-96,47,-1], "legR":[18,33,-93,37,8], "footL":[-6,7,0], "footR":[6,27,-1]},
  {"t":0.567,
   "hips":[2,1,91], "body":[-1,5,-1], "chest":[-2,27,5], "head":[1,-3,-4],
   "shL":[6,-8], "shR":[7,-9], "armL":[34,26,-90,13,20], "armR":[27,19,-94,0,-28], "handL":[-11,-6,123], "handR":[-13,-6,146], "fingersL":[0,0,0,0,0], "fingersR":[0,0,0,0,0],
   "legL":[6,37,-93,40,0], "legR":[13,31,-94,41,7], "footL":[-3,8,-1], "footR":[-3,7,0]},
  {"t":0.7,
   "hips":[2,8,93], "body":[-1,5,1], "chest":[0,25,4], "head":[-2,0,-6],
   "shL":[5,-7], "shR":[6,-10], "armL":[26,25,-93,14,31], "armR":[33,16,-93,0,-11], "handL":[-8,-7,140], "handR":[-15,-5,127], "fingersL":[0,0,0,0,0], "fingersR":[0,0,0,0,0],
   "legL":[9,37,-93,38,-5], "legR":[12,19,-97,45,1], "footL":[3,38,0], "footR":[-5,4,0]},
  {"t":0.767,
   "hips":[1,9,95], "body":[-1,5,1], "chest":[0,26,5], "head":[-2,-1,-6],
   "shL":[5,-8], "shR":[6,-9], "armL":[29,21,-93,15,28], "armR":[38,16,-91,12,-13], "handL":[-6,-5,143], "handR":[-16,-8,126], "fingersL":[0,0,0,0,0], "fingersR":[0,0,0,0,0],
   "legL":[12,29,-95,40,0], "legR":[13,13,-98,40,1], "footL":[-2,31,-1], "footR":[-5,2,0]},
  {"t":0.967,
   "hips":[1,6,97], "body":[-2,7,-2], "chest":[-3,24,6], "head":[0,-1,-1],
   "shL":[5,-7], "shR":[6,-9], "armL":[31,11,-95,24,21], "armR":[35,16,-92,17,-6], "handL":[-3,-4,141], "handR":[-16,-9,120], "fingersL":[0,0,0,0,0], "fingersR":[0,0,0,0,0],
   "legL":[17,1,-98,45,5], "legR":[15,-2,-99,33,-6], "footL":[-5,-2,0], "footR":[-7,-1,0]},
  {"t":1.067,
   "hips":[0,3,96], "body":[-1,6,-3], "chest":[-3,27,4], "head":[-1,-2,1],
   "shL":[5,-8], "shR":[7,-8], "armL":[35,11,-93,22,18], "armR":[38,13,-91,6,-4], "handL":[-5,-5,139], "handR":[-17,-5,119], "fingersL":[0,0,0,0,0], "fingersR":[0,0,0,0,0],
   "legL":[15,-2,-99,42,-1], "legR":[15,-6,-99,37,-6], "footL":[-5,7,0], "footR":[-6,-4,0]},
  {"t":1.167,
   "hips":[0,0,95], "body":[0,7,-4], "chest":[-3,28,2], "head":[-1,-3,2],
   "shL":[6,-8], "shR":[7,-9], "armL":[34,13,-93,17,15], "armR":[38,10,-92,13,-7], "handL":[-9,-6,133], "handR":[-14,-7,127], "fingersL":[0,0,0,0,0], "fingersR":[0,0,0,0,0],
   "legL":[15,3,-99,43,1], "legR":[17,-11,-98,45,-9], "footL":[-7,8,0], "footR":[-4,-8,0]}
]}
