{
"format": "2.0",
"id": "CMU_CURATED/Sad",
"name": "Sad",
"legend": "2.0",
"dur": 6,
"loop": false,
"fps": 30,
"tags": ["emote"],
"desc": "Sad",
"skeleton": "humanoid",
"restSrc": "CMU_79",
"contacts": {"by":"detected","footL":[[0,6]]},
"facts": {"by":"m3a-facts@1","height":[101,102],"travel":[1,4]},
"provenance": {"src":"CMU_79","take":"79_71 1.10-7.10","method":"captured","producer":{"tool":"m3a-import","version":"1"},"license":"LicenseRef-CMU-Mocap","credit":"CMU Graphics Lab Motion Capture Database (mocap.cs.cmu.edu)","ai":"digitalCapture"},
"quality": {"fit":[14,75],"qa":"unchecked","qaVersion":"none"},
"keys": [
  {"t":0,
   "hips":[0,0,102], "body":[5,0,-4], "chest":[-9,2,2], "head":[1,13,3], "root":[0,0], "spine":[30,67,94],
   "shL":[0,0], "shR":[-1,0], "armL":[25,-6,-97,34,18], "armR":[21,2,-98,43,-29], "handL":[0,7,138], "handR":[1,-7,138], "fingersL":[9,9,9,9,9], "fingersR":[2,2,2,2,2],
   "legL":[-16,18,-97,20,-17], "legR":[-1,34,-94,0,-50], "footL":[-5,9,54], "footR":[-3,7,-3]},
  {"t":0.233,
   "hips":[0,0,102], "body":[5,0,-4], "chest":[-9,1,2], "head":[3,21,9], "root":[0,0], "spine":[13,48,97],
   "shL":[0,0], "shR":[0,0], "armL":[23,-6,-97,35,19], "armR":[25,4,-97,51,-30], "handL":[0,7,138], "handR":[1,-7,129], "fingersL":[9,9,9,9,9], "fingersR":[3,3,3,3,3],
   "legL":[-16,18,-97,20,-16], "legR":[0,34,-94,0,-50], "footL":[-5,9,54], "footR":[-3,6,-3]},
  {"t":0.567,
   "hips":[0,0,102], "body":[6,0,-4], "chest":[-8,2,4], "head":[2,38,17], "root":[-1,1], "spine":[51,91,99],
   "shL":[0,0], "shR":[0,0], "armL":[21,-2,-98,36,20], "armR":[65,13,-75,89,-33], "handL":[0,7,136], "handR":[0,-7,121], "fingersL":[9,9,9,9,9], "fingersR":[4,4,4,4,4],
   "legL":[-16,18,-97,20,-14], "legR":[0,34,-94,0,-24], "footL":[-6,10,53], "footR":[-3,6,-3]},
  {"t":0.867,
   "hips":[0,0,102], "body":[5,0,-4], "chest":[-8,4,7], "head":[4,49,20], "root":[0,2], "spine":[62,99,98],
   "shL":[0,0], "shR":[0,0], "armL":[20,-1,-98,38,20], "armR":[97,3,-26,125,-26], "handL":[0,7,134], "handR":[0,-7,118], "fingersL":[9,9,9,9,9], "fingersR":[0,0,0,0,0],
   "legL":[-16,20,-97,19,-16], "legR":[0,34,-94,0,15], "footL":[-5,10,54], "footR":[-4,6,-3]},
  {"t":1.133,
   "hips":[0,0,102], "body":[5,0,-4], "chest":[-8,6,9], "head":[4,54,23], "root":[0,3], "spine":[66,104,104],
   "shL":[0,0], "shR":[0,0], "armL":[20,-2,-98,42,20], "armR":[98,-19,11,139,-18], "handL":[0,7,132], "handR":[0,-7,113], "fingersL":[10,10,10,10,10], "fingersR":[0,0,0,0,0],
   "legL":[-16,21,-96,19,-15], "legR":[1,34,-94,0,15], "footL":[-4,11,54], "footR":[-4,6,-3]},
  {"t":1.5,
   "hips":[0,0,102], "body":[4,1,-4], "chest":[-6,9,13], "head":[-2,54,24], "root":[0,5], "spine":[63,100,103],
   "shL":[0,0], "shR":[0,0], "armL":[23,-5,-97,45,21], "armR":[93,-27,24,143,-13], "handL":[1,7,130], "handR":[0,-8,111], "fingersL":[9,9,9,9,9], "fingersR":[0,0,0,0,0],
   "legL":[-14,23,-96,19,-16], "legR":[0,35,-94,0,50], "footL":[-5,11,54], "footR":[-4,7,-3]},
  {"t":2.167,
   "hips":[0,0,102], "body":[-1,4,-4], "chest":[-10,15,18], "head":[-17,48,34], "root":[-1,8], "spine":[68,102,99],
   "shL":[0,0], "shR":[0,0], "armL":[28,-7,-96,49,19], "armR":[90,-25,36,143,-12], "handL":[0,6,125], "handR":[-1,-10,103], "fingersL":[8,8,8,8,8], "fingersR":[0,0,0,0,0],
   "legL":[-4,26,-96,25,-15], "legR":[0,34,-94,0,50], "footL":[-5,9,54], "footR":[-4,6,-3]},
  {"t":2.767,
   "hips":[0,0,102], "body":[12,5,-6], "chest":[-11,19,6], "head":[3,49,16], "root":[-4,3], "spine":[65,99,98],
   "shL":[-1,0], "shR":[0,0], "armL":[35,3,-94,46,23], "armR":[88,-27,39,144,-6], "handL":[0,6,127], "handR":[-2,-12,88], "fingersL":[6,6,6,6,6], "fingersR":[4,4,4,4,4],
   "legL":[-6,23,-97,26,-10], "legR":[1,35,-94,0,83], "footL":[-12,16,50], "footR":[-4,6,-3]},
  {"t":3.4,
   "hips":[0,0,102], "body":[14,4,-6], "chest":[-9,18,-2], "head":[1,18,6], "root":[-5,0], "spine":[65,99,98],
   "shL":[0,0], "shR":[0,0], "armL":[37,10,-93,46,26], "armR":[76,-35,55,141,3], "handL":[0,6,128], "handR":[-2,-12,98], "fingersL":[6,6,6,6,6], "fingersR":[0,0,0,0,0],
   "legL":[-6,20,-98,27,-9], "legR":[0,34,-94,0,83], "footL":[-12,17,50], "footR":[-4,7,-3]},
  {"t":4.067,
   "hips":[0,0,102], "body":[17,2,-7], "chest":[-9,18,-5], "head":[25,39,-14], "root":[-6,2], "spine":[65,99,99],
   "shL":[0,0], "shR":[0,0], "armL":[35,13,-93,45,27], "armR":[79,-31,53,142,0], "handL":[-1,6,129], "handR":[-1,-10,95], "fingersL":[6,6,6,6,6], "fingersR":[0,0,0,0,0],
   "legL":[-11,24,-96,25,-10], "legR":[0,33,-94,0,83], "footL":[-12,20,48], "footR":[-3,6,-3]},
  {"t":4.533,
   "hips":[0,0,101], "body":[9,0,-8], "chest":[-7,18,-4], "head":[-6,55,-5], "root":[-3,4], "spine":[68,106,102],
   "shL":[0,0], "shR":[0,0], "armL":[37,12,-92,48,30], "armR":[72,-46,52,140,11], "handL":[-1,6,122], "handR":[1,-13,96], "fingersL":[4,4,4,4,4], "fingersR":[9,9,9,9,9],
   "legL":[-15,28,-95,28,-12], "legR":[1,35,-94,0,83], "footL":[-6,16,50], "footR":[-4,6,-3]},
  {"t":4.867,
   "hips":[0,0,101], "body":[-6,-1,-7], "chest":[-15,19,2], "head":[-29,51,31], "root":[1,4], "spine":[73,108,102],
   "shL":[0,0], "shR":[0,0], "armL":[33,10,-94,48,27], "armR":[80,-30,52,141,-7], "handL":[-2,6,122], "handR":[3,-11,90], "fingersL":[1,1,1,1,1], "fingersR":[21,21,21,21,21],
   "legL":[-14,28,-95,29,-17], "legR":[-1,34,-94,0,92], "footL":[1,6,55], "footR":[-3,7,-3]},
  {"t":5.133,
   "hips":[0,0,101], "body":[-9,0,-5], "chest":[-18,19,8], "head":[-16,50,34], "root":[2,3], "spine":[68,102,97],
   "shL":[0,0], "shR":[0,0], "armL":[27,6,-96,49,23], "armR":[83,-14,54,143,-26], "handL":[-1,5,122], "handR":[2,-12,85], "fingersL":[3,3,3,3,3], "fingersR":[23,23,23,23,23],
   "legL":[-12,24,-96,30,-17], "legR":[-1,35,-94,0,92], "footL":[1,2,56], "footR":[-3,7,-3]},
  {"t":5.367,
   "hips":[0,0,102], "body":[-7,1,-5], "chest":[-15,18,14], "head":[6,53,25], "root":[2,3], "spine":[69,106,101],
   "shL":[0,0], "shR":[0,0], "armL":[28,-2,-96,50,20], "armR":[90,1,43,142,-38], "handL":[-1,6,119], "handR":[2,-10,84], "fingersL":[5,5,5,5,5], "fingersR":[22,22,22,22,22],
   "legL":[-11,24,-96,25,-16], "legR":[0,34,-94,0,105], "footL":[0,4,56], "footR":[-3,7,-3]},
  {"t":5.533,
   "hips":[0,0,102], "body":[-4,1,-4], "chest":[-14,17,17], "head":[22,53,19], "root":[2,4], "spine":[65,102,101],
   "shL":[0,0], "shR":[0,0], "armL":[31,-7,-95,52,17], "armR":[97,18,16,131,-42], "handL":[-1,7,115], "handR":[1,-10,87], "fingersL":[5,5,5,5,5], "fingersR":[13,13,13,13,13],
   "legL":[-12,22,-97,24,-15], "legR":[1,35,-94,0,122], "footL":[0,6,56], "footR":[-4,6,-3]},
  {"t":5.767,
   "hips":[0,0,102], "body":[-1,-1,-4], "chest":[-10,17,21], "head":[37,49,17], "root":[2,4], "spine":[62,98,102],
   "shL":[0,0], "shR":[0,0], "armL":[30,-10,-95,51,15], "armR":[87,32,-37,98,-42], "handL":[-1,6,115], "handR":[-2,-10,99], "fingersL":[6,6,6,6,6], "fingersR":[0,0,0,0,0],
   "legL":[-16,22,-96,22,-13], "legR":[-1,34,-94,0,122], "footL":[1,10,56], "footR":[-3,6,-3]},
  {"t":6,
   "hips":[0,0,101], "body":[5,-2,-4], "chest":[-7,16,25], "head":[47,43,16], "root":[1,4], "spine":[54,89,99],
   "shL":[0,-1], "shR":[1,1], "armL":[26,-10,-96,50,16], "armR":[56,35,-75,64,-44], "handL":[0,5,119], "handR":[-1,-11,113], "fingersL":[7,7,7,7,7], "fingersR":[0,0,0,0,0],
   "legL":[-20,21,-96,26,-8], "legR":[-1,34,-94,0,122], "footL":[1,15,55], "footR":[-3,7,-3]}
]}
