{
"format": "2.0",
"id": "QUATERNIUS_3D2DGE/Walk_Formal_Loop",
"name": "Walk_Formal_Loop",
"legend": "2.0",
"dur": 1.333,
"loop": true,
"fps": 30,
"tags": ["walk"],
"desc": "upright, measured walk, in place",
"skeleton": "humanoid",
"restSrc": "UAL1",
"provenance": {"src":"UAL1","method":"keyed","producer":{"tool":"m3a-migrate","version":"1"},"license":"CC0-1.0","ai":"digitalCreation"},
"quality": {"fit":[15,91],"qa":"unchecked","qaVersion":"none"},
"keys": [
  {"t":0,
   "hips":[-5,1,95], "body":[-2,0,-2], "chest":[-3,10,2], "head":[3,5,1],
   "shL":[-5,0], "shR":[0,0], "armL":[28,12,-95,53,-14], "armR":[26,14,-96,49,5],
   "legL":[32,3,-95,15,-8], "legR":[-45,-5,-89,31,4], "footL":[-26,-2,0], "footR":[36,-8,36]},
  {"t":0.067,
   "hips":[-5,1,96], "body":[-2,0,-2], "chest":[-3,11,2], "head":[3,4,0],
   "shL":[-5,0], "shR":[0,0], "armL":[27,13,-95,50,-15], "armR":[29,13,-95,49,1],
   "legL":[24,3,-97,24,-4], "legR":[-55,-5,-83,24,6], "footL":[-17,-2,0], "footR":[50,-17,23]},
  {"t":0.133,
   "hips":[-5,0,97], "body":[-2,0,-2], "chest":[-3,12,2], "head":[3,3,0],
   "shL":[-4,0], "shR":[-1,0], "armL":[26,13,-96,50,-12], "armR":[30,13,-94,49,3],
   "legL":[15,3,-99,27,-8], "legR":[-58,-5,-81,13,3], "footL":[-3,-1,0], "footR":[41,-4,4]},
  {"t":0.2,
   "hips":[-5,-1,98], "body":[-1,0,-1], "chest":[-3,13,1], "head":[3,2,0],
   "shL":[-4,1], "shR":[-2,0], "armL":[25,14,-96,47,-13], "armR":[31,13,-94,51,3],
   "legL":[6,0,-100,25,-6], "legR":[-52,-1,-86,44,5], "footL":[0,0,0], "footR":[46,-3,0]},
  {"t":0.3,
   "hips":[-5,-2,99], "body":[0,0,0], "chest":[-2,14,0], "head":[2,1,0],
   "shL":[-3,0], "shR":[-4,0], "armL":[25,16,-95,49,-11], "armR":[33,12,-94,52,4],
   "legL":[-7,-2,-100,16,-8], "legR":[-34,3,-94,81,6], "footL":[0,0,0], "footR":[47,-180,-25]},
  {"t":0.367,
   "hips":[-5,-2,99], "body":[0,0,0], "chest":[-1,13,0], "head":[1,2,0],
   "shL":[-2,1], "shR":[-6,0], "armL":[25,16,-95,47,-10], "armR":[32,12,-94,52,5],
   "legL":[-15,-2,-99,11,-7], "legR":[-14,3,-99,88,6], "footL":[1,0,1], "footR":[48,-180,-24]},
  {"t":0.433,
   "hips":[-5,-2,98], "body":[1,0,1], "chest":[0,12,0], "head":[0,3,-2],
   "shL":[-1,0], "shR":[-6,0], "armL":[25,16,-95,48,-10], "armR":[30,12,-95,54,5],
   "legL":[-22,-4,-97,23,-4], "legR":[7,4,-100,84,7], "footL":[8,0,8], "footR":[47,-356,0]},
  {"t":0.5,
   "hips":[-5,-3,97], "body":[1,0,2], "chest":[1,11,-1], "head":[0,4,-2],
   "shL":[0,0], "shR":[-8,0], "armL":[26,16,-95,49,-6], "armR":[28,14,-95,53,8],
   "legL":[-29,-7,-95,33,-6], "legR":[22,7,-97,68,6], "footL":[18,-2,18], "footR":[15,-359,0]},
  {"t":0.6,
   "hips":[-5,-2,96], "body":[2,0,2], "chest":[2,10,-1], "head":[-1,5,-2],
   "shL":[0,0], "shR":[-8,0], "armL":[27,17,-95,47,-5], "armR":[24,13,-96,49,9],
   "legL":[-38,-6,-92,37,-4], "legR":[30,4,-95,32,7], "footL":[32,-6,32], "footR":[-19,-362,0]},
  {"t":0.667,
   "hips":[-5,-2,95], "body":[2,0,3], "chest":[3,10,-2], "head":[-2,5,-2],
   "shL":[0,0], "shR":[-8,0], "armL":[28,17,-94,50,-6], "armR":[21,13,-97,50,12],
   "legL":[-45,-7,-89,30,-6], "legR":[32,6,-94,16,9], "footL":[36,-10,35], "footR":[-27,-362,0]},
  {"t":0.767,
   "hips":[-5,-1,96], "body":[2,0,2], "chest":[3,12,-1], "head":[-3,3,-2],
   "shL":[-1,0], "shR":[-8,0], "armL":[31,16,-94,50,-5], "armR":[19,15,-97,47,14],
   "legL":[-49,-5,-87,17,-5], "legR":[20,4,-98,28,8], "footL":[37,-4,13], "footR":[-9,-361,0]},
  {"t":0.833,
   "hips":[-5,-1,97], "body":[1,0,2], "chest":[3,13,-1], "head":[-2,2,-2],
   "shL":[-1,0], "shR":[-8,0], "armL":[32,15,-94,52,-4], "armR":[17,16,-97,46,19],
   "legL":[-51,-5,-86,39,-6], "legR":[11,4,-99,29,4], "footL":[52,-15,0], "footR":[0,-360,0]},
  {"t":0.867,
   "hips":[-5,0,98], "body":[1,0,1], "chest":[3,14,0], "head":[-2,1,-2],
   "shL":[-1,-1], "shR":[-7,0], "armL":[32,15,-93,52,-3], "armR":[17,16,-97,44,18],
   "legL":[-50,-2,-87,53,-6], "legR":[6,1,-100,25,5], "footL":[55,-166,-8], "footR":[0,-360,0]},
  {"t":0.933,
   "hips":[-5,0,99], "body":[1,0,1], "chest":[2,14,-1], "head":[-2,1,-1],
   "shL":[-2,0], "shR":[-5,0], "armL":[33,15,-93,52,-3], "armR":[16,15,-98,42,18],
   "legL":[-42,-2,-91,75,-6], "legR":[-2,2,-100,19,6], "footL":[40,-176,-39], "footR":[0,-360,0]},
  {"t":1,
   "hips":[-5,1,99], "body":[0,0,0], "chest":[1,14,0], "head":[-1,1,0],
   "shL":[-2,0], "shR":[-5,0], "armL":[34,14,-93,54,-4], "armR":[16,15,-97,43,19],
   "legL":[-25,2,-97,88,-6], "legR":[-11,-1,-99,13,6], "footL":[35,-180,-49], "footR":[0,-360,0]},
  {"t":1.1,
   "hips":[-5,2,98], "body":[-1,0,-1], "chest":[0,12,1], "head":[0,3,0],
   "shL":[-3,0], "shR":[-3,0], "armL":[32,13,-94,55,-9], "armR":[18,15,-97,45,13],
   "legL":[7,4,-100,85,-6], "legR":[-22,-4,-97,23,7], "footL":[51,-354,0], "footR":[8,-360,8]},
  {"t":1.167,
   "hips":[-5,2,97], "body":[-1,0,-2], "chest":[-1,11,2], "head":[0,4,0],
   "shL":[-4,0], "shR":[-1,0], "armL":[32,12,-94,55,-8], "armR":[20,15,-97,46,11],
   "legL":[22,6,-97,70,-6], "legR":[-29,-6,-96,33,6], "footL":[15,-359,0], "footR":[18,-362,18]},
  {"t":1.2,
   "hips":[-5,2,97], "body":[-2,0,-2], "chest":[-1,11,2], "head":[1,4,0],
   "shL":[-4,0], "shR":[-1,0], "armL":[32,12,-94,53,-9], "armR":[22,14,-97,44,9],
   "legL":[26,5,-96,58,-7], "legR":[-32,-6,-95,34,5], "footL":[0,-361,0], "footR":[23,-362,23]},
  {"t":1.333,
   "hips":[-5,1,95], "body":[-2,0,-2], "chest":[-3,10,2], "head":[3,5,1],
   "shL":[-5,0], "shR":[0,0], "armL":[28,12,-95,53,-14], "armR":[26,14,-96,49,5],
   "legL":[32,3,-95,15,-8], "legR":[-45,-5,-89,31,4], "footL":[-26,-362,0], "footR":[36,-368,36]}
]}
