{
"format": "2.0",
"id": "STYLE100_IDLE/BeatChest_Idle",
"name": "BeatChest_Idle",
"legend": "2.0",
"dur": 2.7,
"loop": true,
"fps": 30,
"tags": ["idle","style"],
"desc": "Standing, beat chest style: beat chest while moving normally",
"skeleton": "humanoid",
"restSrc": "100STYLE",
"provenance": {"src":"100STYLE","take":"BeatChest_ID 17.75-20.45","method":"captured","producer":{"tool":"m3a-import","version":"1"},"license":"CC-BY-4.0","credit":"100STYLE, Mason, Starke and Komura (CC BY 4.0)","ai":"digitalCapture"},
"quality": {"fit":[6,30],"qa":"unchecked","qaVersion":"none"},
"keys": [
  {"t":0,
   "hips":[0,0,100], "body":[0,-5,0], "chest":[-2,12,-2], "head":[6,6,1],
   "shL":[5,1], "shR":[1,3], "armL":[93,-36,-13,137,-40], "armR":[83,-40,-40,133,54], "handL":[4,4,53], "handR":[11,10,61], "fingersL":[0,0,0,0,0], "fingersR":[0,0,0,0,0],
   "legL":[-16,0,-99,12,7], "legR":[-17,-1,-99,11,4], "footL":[5,-5,0], "footR":[5,-2,0]},
  {"t":0.1,
   "hips":[0,0,100], "body":[1,-5,0], "chest":[-2,12,-2], "head":[5,6,0],
   "shL":[4,1], "shR":[1,3], "armL":[88,-40,-25,139,-46], "armR":[92,-33,-22,129,43], "handL":[29,8,68], "handR":[3,10,56], "fingersL":[0,0,0,0,0], "fingersR":[0,0,0,0,0],
   "legL":[-16,0,-99,12,5], "legR":[-17,-1,-99,11,2], "footL":[5,-4,0], "footR":[5,-3,0]},
  {"t":0.167,
   "hips":[0,0,100], "body":[1,-5,0], "chest":[-2,12,-2], "head":[6,6,0],
   "shL":[4,0], "shR":[1,4], "armL":[86,-43,-27,140,-48], "armR":[94,-30,-17,128,39], "handL":[28,8,71], "handR":[-3,9,52], "fingersL":[0,0,0,0,0], "fingersR":[0,0,0,0,0],
   "legL":[-16,0,-99,11,4], "legR":[-17,-1,-99,10,0], "footL":[5,-4,0], "footR":[5,-3,0]},
  {"t":0.367,
   "hips":[0,0,100], "body":[-1,-5,0], "chest":[-1,12,-3], "head":[6,6,1],
   "shL":[4,1], "shR":[2,3], "armL":[93,-35,-12,136,-40], "armR":[81,-41,-42,135,54], "handL":[3,5,53], "handR":[12,10,63], "fingersL":[0,0,0,0,0], "fingersR":[0,0,0,0,0],
   "legL":[-16,0,-99,12,5], "legR":[-17,-2,-99,10,-12], "footL":[5,-6,0], "footR":[5,-1,0]},
  {"t":0.5,
   "hips":[0,0,100], "body":[0,-5,0], "chest":[-1,11,-3], "head":[5,7,0],
   "shL":[4,1], "shR":[2,3], "armL":[86,-43,-29,139,-49], "armR":[92,-32,-21,129,41], "handL":[32,8,71], "handR":[5,10,57], "fingersL":[0,0,0,0,0], "fingersR":[0,0,0,0,0],
   "legL":[-16,0,-99,12,3], "legR":[-17,-1,-99,11,-1], "footL":[5,-5,0], "footR":[5,-2,0]},
  {"t":0.567,
   "hips":[0,0,100], "body":[0,-5,0], "chest":[-1,11,-3], "head":[5,8,0],
   "shL":[5,1], "shR":[2,3], "armL":[86,-43,-27,140,-48], "armR":[94,-30,-17,128,39], "handL":[27,7,68], "handR":[-2,9,51], "fingersL":[0,0,0,0,0], "fingersR":[0,0,0,0,0],
   "legL":[-16,0,-99,12,2], "legR":[-17,-1,-99,11,-1], "footL":[5,-5,0], "footR":[5,-2,0]},
  {"t":0.767,
   "hips":[0,0,100], "body":[-1,-5,0], "chest":[-1,10,-3], "head":[6,8,0],
   "shL":[5,1], "shR":[2,4], "armL":[93,-34,-14,135,-39], "armR":[80,-40,-45,132,55], "handL":[7,5,58], "handR":[14,11,63], "fingersL":[0,0,0,0,0], "fingersR":[0,0,0,0,0],
   "legL":[-16,0,-99,12,4], "legR":[-17,-2,-99,11,-12], "footL":[5,-6,0], "footR":[5,-1,0]},
  {"t":0.9,
   "hips":[0,0,100], "body":[0,-5,0], "chest":[-1,10,-3], "head":[5,9,0],
   "shL":[5,1], "shR":[2,4], "armL":[84,-43,-33,139,-50], "armR":[92,-31,-24,128,42], "handL":[30,7,71], "handR":[3,10,54], "fingersL":[0,0,0,0,0], "fingersR":[0,0,0,0,0],
   "legL":[-16,0,-99,12,3], "legR":[-17,-1,-99,11,0], "footL":[5,-5,0], "footR":[5,-2,0]},
  {"t":0.967,
   "hips":[0,0,100], "body":[0,-5,0], "chest":[-1,10,-3], "head":[5,9,0],
   "shL":[5,1], "shR":[2,4], "armL":[88,-40,-27,137,-46], "armR":[93,-30,-21,127,41], "handL":[29,9,72], "handR":[-5,10,48], "fingersL":[0,0,0,0,0], "fingersR":[0,0,0,0,0],
   "legL":[-16,0,-99,12,4], "legR":[-17,-1,-99,11,1], "footL":[5,-5,0], "footR":[5,-2,0]},
  {"t":1.133,
   "hips":[0,0,100], "body":[0,-5,0], "chest":[-1,10,-3], "head":[5,9,0],
   "shL":[4,1], "shR":[3,4], "armL":[93,-33,-14,135,-39], "armR":[78,-42,-47,133,58], "handL":[5,7,59], "handR":[8,10,62], "fingersL":[0,0,0,0,0], "fingersR":[0,0,0,0,0],
   "legL":[-16,0,-99,11,7], "legR":[-17,-1,-99,11,4], "footL":[5,-5,0], "footR":[5,-2,0]},
  {"t":1.3,
   "hips":[0,0,100], "body":[1,-5,0], "chest":[-2,10,-3], "head":[5,9,1],
   "shL":[5,1], "shR":[2,3], "armL":[83,-44,-34,140,-51], "armR":[93,-31,-21,128,41], "handL":[31,6,70], "handR":[-2,10,53], "fingersL":[0,0,0,0,0], "fingersR":[0,0,0,0,0],
   "legL":[-16,0,-99,12,7], "legR":[-17,-1,-99,11,3], "footL":[5,-4,0], "footR":[5,-3,0]},
  {"t":1.367,
   "hips":[0,0,100], "body":[1,-5,0], "chest":[-1,10,-3], "head":[4,10,0],
   "shL":[4,1], "shR":[3,3], "armL":[87,-40,-28,138,-47], "armR":[93,-33,-18,128,41], "handL":[30,8,70], "handR":[-6,10,50], "fingersL":[0,0,0,0,0], "fingersR":[0,0,0,0,0],
   "legL":[-16,0,-99,12,8], "legR":[-17,-1,-99,11,4], "footL":[5,-4,0], "footR":[5,-3,0]},
  {"t":1.5,
   "hips":[0,0,100], "body":[0,-5,0], "chest":[-1,10,-3], "head":[5,9,1],
   "shL":[4,1], "shR":[3,3], "armL":[93,-33,-15,134,-40], "armR":[80,-42,-44,133,56], "handL":[6,7,56], "handR":[16,12,66], "fingersL":[1,1,1,1,1], "fingersR":[0,0,0,0,0],
   "legL":[-16,0,-99,12,11], "legR":[-17,-1,-99,11,8], "footL":[5,-5,0], "footR":[5,-2,0]},
  {"t":1.567,
   "hips":[0,0,100], "body":[0,-5,0], "chest":[-1,10,-3], "head":[5,9,1],
   "shL":[4,2], "shR":[3,3], "armL":[93,-33,-18,134,-41], "armR":[82,-41,-40,132,53], "handL":[7,6,55], "handR":[13,11,63], "fingersL":[0,0,0,0,0], "fingersR":[0,0,0,0,0],
   "legL":[-16,0,-99,12,10], "legR":[-17,-1,-99,11,8], "footL":[5,-5,0], "footR":[5,-2,0]},
  {"t":1.667,
   "hips":[0,0,100], "body":[1,-5,0], "chest":[-1,10,-3], "head":[4,9,1],
   "shL":[4,2], "shR":[3,3], "armL":[85,-41,-33,139,-49], "armR":[92,-34,-21,127,41], "handL":[31,3,65], "handR":[3,9,54], "fingersL":[0,0,0,0,0], "fingersR":[0,0,0,0,0],
   "legL":[-16,0,-99,12,9], "legR":[-17,-1,-99,11,6], "footL":[5,-4,0], "footR":[5,-3,0]},
  {"t":1.733,
   "hips":[0,0,100], "body":[1,-5,0], "chest":[-2,10,-3], "head":[5,9,1],
   "shL":[5,2], "shR":[2,3], "armL":[84,-44,-33,138,-50], "armR":[94,-30,-18,127,39], "handL":[29,4,64], "handR":[-4,10,50], "fingersL":[0,0,0,0,0], "fingersR":[0,0,0,0,0],
   "legL":[-16,0,-99,12,11], "legR":[-17,-1,-99,11,6], "footL":[5,-4,0], "footR":[5,-3,0]},
  {"t":1.9,
   "hips":[0,0,100], "body":[0,-5,0], "chest":[-1,11,-2], "head":[5,7,0],
   "shL":[4,0], "shR":[3,4], "armL":[93,-33,-14,135,-38], "armR":[79,-43,-44,133,57], "handL":[8,5,49], "handR":[14,10,61], "fingersL":[0,0,0,0,0], "fingersR":[0,0,0,0,0],
   "legL":[-16,0,-99,12,13], "legR":[-17,-1,-99,11,9], "footL":[5,-5,0], "footR":[5,-2,0]},
  {"t":2.067,
   "hips":[0,0,100], "body":[1,-5,0], "chest":[-2,11,-2], "head":[5,8,0],
   "shL":[5,1], "shR":[1,4], "armL":[84,-43,-35,139,-50], "armR":[93,-30,-19,126,40], "handL":[33,4,68], "handR":[0,11,52], "fingersL":[1,1,1,1,1], "fingersR":[0,0,0,0,0],
   "legL":[-16,0,-99,12,9], "legR":[-17,-1,-99,11,5], "footL":[5,-4,0], "footR":[5,-3,0]},
  {"t":2.133,
   "hips":[0,0,100], "body":[1,-5,0], "chest":[-2,11,-2], "head":[5,8,0],
   "shL":[5,1], "shR":[2,4], "armL":[88,-39,-27,138,-45], "armR":[94,-30,-17,126,40], "handL":[29,5,65], "handR":[-5,11,51], "fingersL":[0,0,0,0,0], "fingersR":[0,0,0,0,0],
   "legL":[-16,0,-99,12,9], "legR":[-17,-1,-99,11,5], "footL":[5,-4,0], "footR":[5,-3,0]},
  {"t":2.267,
   "hips":[0,0,100], "body":[0,-5,0], "chest":[-2,11,-2], "head":[6,7,1],
   "shL":[5,1], "shR":[2,4], "armL":[94,-33,-12,135,-37], "armR":[82,-40,-42,132,55], "handL":[7,4,54], "handR":[15,12,63], "fingersL":[0,0,0,0,0], "fingersR":[0,0,0,0,0],
   "legL":[-16,0,-99,12,10], "legR":[-17,-1,-99,11,7], "footL":[5,-5,0], "footR":[5,-2,0]},
  {"t":2.333,
   "hips":[0,0,100], "body":[0,-5,0], "chest":[-1,11,-2], "head":[5,8,1],
   "shL":[4,0], "shR":[3,4], "armL":[94,-31,-12,135,-37], "armR":[82,-40,-41,131,55], "handL":[10,4,57], "handR":[11,13,62], "fingersL":[1,1,1,1,1], "fingersR":[0,0,0,0,0],
   "legL":[-16,0,-99,12,9], "legR":[-17,-1,-99,11,6], "footL":[5,-5,0], "footR":[5,-2,0]},
  {"t":2.433,
   "hips":[0,0,100], "body":[1,-5,0], "chest":[-2,11,-2], "head":[5,8,1],
   "shL":[4,1], "shR":[2,3], "armL":[85,-41,-32,139,-49], "armR":[92,-32,-22,127,42], "handL":[30,5,68], "handR":[0,12,51], "fingersL":[0,0,0,0,0], "fingersR":[0,0,0,0,0],
   "legL":[-16,0,-99,12,6], "legR":[-17,-1,-99,11,4], "footL":[5,-4,0], "footR":[5,-3,0]},
  {"t":2.5,
   "hips":[0,0,100], "body":[1,-5,0], "chest":[-2,11,-2], "head":[5,8,1],
   "shL":[4,1], "shR":[2,3], "armL":[85,-41,-32,138,-49], "armR":[94,-30,-18,126,41], "handL":[26,5,68], "handR":[-3,13,49], "fingersL":[0,0,0,0,0], "fingersR":[0,0,0,0,0],
   "legL":[-16,0,-99,12,6], "legR":[-17,-1,-99,11,4], "footL":[5,-4,0], "footR":[5,-3,0]},
  {"t":2.633,
   "hips":[0,0,100], "body":[0,-5,0], "chest":[-2,11,-2], "head":[6,7,1],
   "shL":[5,1], "shR":[2,4], "armL":[93,-35,-15,136,-40], "armR":[83,-38,-41,132,54], "handL":[9,6,56], "handR":[15,12,64], "fingersL":[0,0,0,0,0], "fingersR":[0,0,0,0,0],
   "legL":[-16,0,-99,12,8], "legR":[-17,-1,-99,11,5], "footL":[5,-5,0], "footR":[5,-2,0]},
  {"t":2.7,
   "hips":[0,0,100], "body":[0,-5,0], "chest":[-2,12,-2], "head":[6,6,1],
   "shL":[5,1], "shR":[1,3], "armL":[93,-36,-13,137,-40], "armR":[83,-40,-40,133,54], "handL":[4,4,53], "handR":[11,10,61], "fingersL":[0,0,0,0,0], "fingersR":[0,0,0,0,0],
   "legL":[-16,0,-99,12,7], "legR":[-17,-1,-99,11,4], "footL":[5,-5,0], "footR":[5,-2,0]}
]}
