{
"format": "2.0",
"id": "QUATERNIUS_SHARDFALL/Farm_Harvest",
"name": "Farm_Harvest",
"legend": "2.0",
"dur": 2.5,
"loop": false,
"fps": 30,
"tags": ["farm","work"],
"desc": "bends down and pulls a crop up out of the ground",
"skeleton": "humanoid",
"restSrc": "UAL2",
"provenance": {"src":"UAL2","method":"keyed","producer":{"tool":"m3a-migrate","version":"1"},"license":"CC0-1.0","ai":"digitalCreation"},
"quality": {"fit":[15,109],"qa":"unchecked","qaVersion":"none"},
"keys": [
  {"t":0,
   "hips":[-9,-1,96], "body":[13,-5,0], "chest":[0,19,0], "head":[-11,-18,0],
   "shL":[7,-3], "shR":[-6,-2], "armL":[29,19,-94,53,7], "armR":[28,17,-94,61,-4],
   "legL":[5,17,-98,20,4], "legR":[-31,14,-94,9,-42], "footL":[5,8,0], "footR":[4,32,0]},
  {"t":0.067,
   "hips":[-10,-1,95], "body":[13,-4,0], "chest":[0,20,0], "head":[-1,-6,1],
   "shL":[6,-2], "shR":[-6,-2], "armL":[33,20,-92,53,7], "armR":[33,16,-93,60,-4],
   "legL":[8,17,-98,26,7], "legR":[-29,14,-95,21,-38], "footL":[4,8,0], "footR":[3,32,0]},
  {"t":0.133,
   "hips":[-11,-1,93], "body":[12,1,0], "chest":[0,21,0], "head":[13,12,3],
   "shL":[6,-2], "shR":[-6,-3], "armL":[43,20,-88,58,8], "armR":[41,14,-90,58,-6],
   "legL":[18,18,-97,37,6], "legR":[-21,14,-97,35,-38], "footL":[-1,6,0], "footR":[-1,31,0]},
  {"t":0.267,
   "hips":[-15,-2,88], "body":[10,15,1], "chest":[0,27,0], "head":[15,10,5],
   "shL":[6,-3], "shR":[-5,-3], "armL":[70,23,-68,69,14], "armR":[68,9,-73,47,-14],
   "legL":[48,16,-86,54,8], "legR":[5,17,-98,58,-36], "footL":[-15,4,0], "footR":[-13,30,0]},
  {"t":0.433,
   "hips":[-21,-4,82], "body":[6,38,2], "chest":[-1,35,0], "head":[16,3,7],
   "shL":[6,-2], "shR":[-6,-3], "armL":[91,27,-32,82,22], "armR":[94,5,-33,29,-13],
   "legL":[85,13,-51,68,7], "legR":[47,21,-86,78,-35], "footL":[-38,1,0], "footR":[-33,32,-2]},
  {"t":0.6,
   "hips":[-24,-4,81], "body":[1,59,4], "chest":[-2,42,1], "head":[17,-4,8],
   "shL":[6,-3], "shR":[-6,-2], "armL":[93,28,-23,85,22], "armR":[100,0,7,27,5],
   "legL":[99,11,-9,70,8], "legR":[77,22,-60,85,-34], "footL":[-59,-2,0], "footR":[-49,36,-7]},
  {"t":0.733,
   "hips":[-24,-4,86], "body":[-3,67,6], "chest":[-3,45,2], "head":[17,-7,9],
   "shL":[6,-3], "shR":[-6,-2], "armL":[93,27,-26,82,22], "armR":[97,-6,21,36,55],
   "legL":[100,8,4,59,7], "legR":[85,21,-48,76,-35], "footL":[-67,-5,0], "footR":[-55,40,-10]},
  {"t":0.933,
   "hips":[-22,-4,86], "body":[-3,67,6], "chest":[-3,37,1], "head":[16,-2,7],
   "shL":[6,-3], "shR":[-11,-3], "armL":[90,26,-35,79,21], "armR":[100,-6,8,52,31],
   "legL":[100,8,2,62,8], "legR":[84,21,-50,76,-35], "footL":[-67,-5,0], "footR":[-55,40,-10]},
  {"t":1.067,
   "hips":[-24,-4,79], "body":[-3,65,5], "chest":[-4,40,2], "head":[14,-8,7],
   "shL":[6,-2], "shR":[-6,-3], "armL":[87,24,-43,77,20], "armR":[99,-6,13,52,45],
   "legL":[100,8,5,74,6], "legR":[82,22,-53,89,-35], "footL":[-65,-6,0], "footR":[-53,40,-9]},
  {"t":1.167,
   "hips":[-24,-4,78], "body":[-3,65,5], "chest":[-4,44,3], "head":[12,-15,6],
   "shL":[6,-3], "shR":[-6,-2], "armL":[83,24,-50,76,19], "armR":[98,-2,20,53,52],
   "legL":[99,9,5,75,6], "legR":[82,23,-53,91,-35], "footL":[-65,-6,0], "footR":[-53,40,-9]},
  {"t":1.233,
   "hips":[-23,-4,79], "body":[-3,65,5], "chest":[-4,45,3], "head":[11,-18,6],
   "shL":[6,-3], "shR":[-6,-2], "armL":[80,23,-55,72,19], "armR":[98,0,22,50,47],
   "legL":[100,8,3,75,6], "legR":[81,22,-54,89,-35], "footL":[-65,-6,0], "footR":[-53,40,-9]},
  {"t":1.267,
   "hips":[-23,-4,79], "body":[-3,61,5], "chest":[-4,45,3], "head":[11,-18,6],
   "shL":[6,-3], "shR":[-6,-2], "armL":[79,23,-57,71,18], "armR":[98,-1,21,50,22],
   "legL":[100,8,-4,74,6], "legR":[77,23,-60,88,-36], "footL":[-61,-6,0], "footR":[-49,39,-8]},
  {"t":1.333,
   "hips":[-24,-4,80], "body":[-2,50,4], "chest":[-4,45,3], "head":[9,-20,5],
   "shL":[6,-3], "shR":[-6,-2], "armL":[75,23,-62,71,16], "armR":[98,-2,21,64,-21],
   "legL":[97,7,-24,70,7], "legR":[65,23,-73,85,-35], "footL":[-50,-6,0], "footR":[-41,38,-5]},
  {"t":1.4,
   "hips":[-24,-4,83], "body":[-2,50,4], "chest":[-4,45,3], "head":[8,-22,4],
   "shL":[6,-3], "shR":[-6,-2], "armL":[71,22,-66,70,15], "armR":[96,2,27,81,-31],
   "legL":[97,7,-25,64,7], "legR":[65,22,-73,79,-35], "footL":[-50,-6,0], "footR":[-41,38,-5]},
  {"t":1.5,
   "hips":[-24,-4,83], "body":[-2,50,4], "chest":[-4,44,2], "head":[6,-25,3],
   "shL":[6,-2], "shR":[-6,-3], "armL":[65,22,-73,66,14], "armR":[97,7,25,81,-33],
   "legL":[97,7,-25,64,7], "legR":[65,22,-73,79,-35], "footL":[-50,-6,0], "footR":[-41,38,-5]},
  {"t":1.6,
   "hips":[-23,-4,80], "body":[-1,43,4], "chest":[-4,43,1], "head":[4,-27,3],
   "shL":[7,-2], "shR":[-6,-3], "armL":[57,22,-79,61,12], "armR":[99,9,12,79,-32],
   "legL":[92,7,-37,70,8], "legR":[54,23,-81,83,-35], "footL":[-43,-5,0], "footR":[-36,37,-3]},
  {"t":1.7,
   "hips":[-21,-4,78], "body":[1,30,3], "chest":[-4,42,1], "head":[1,-29,1],
   "shL":[6,-2], "shR":[-6,-3], "armL":[50,22,-83,57,11], "armR":[99,11,-7,76,-29],
   "legL":[80,8,-60,74,8], "legR":[31,23,-92,84,-35], "footL":[-30,-4,0], "footR":[-25,36,-1]},
  {"t":1.833,
   "hips":[-18,-3,80], "body":[4,11,2], "chest":[-3,38,1], "head":[-3,-29,0],
   "shL":[6,-2], "shR":[-5,-3], "armL":[42,22,-88,53,8], "armR":[91,11,-40,70,-22],
   "legL":[50,12,-86,69,7], "legR":[-3,20,-98,76,-35], "footL":[-11,-2,0], "footR":[-10,37,0]},
  {"t":2,
   "hips":[-13,-2,86], "body":[9,-5,1], "chest":[-3,32,1], "head":[-7,-27,-1],
   "shL":[6,-3], "shR":[-5,-2], "armL":[37,20,-91,54,7], "armR":[65,14,-75,62,-14],
   "legL":[14,15,-98,55,7], "legR":[-31,17,-93,56,-35], "footL":[5,3,0], "footR":[3,37,0]},
  {"t":2.233,
   "hips":[-10,-1,94], "body":[13,-5,0], "chest":[-1,21,0], "head":[-10,-19,0],
   "shL":[7,-3], "shR":[-6,-3], "armL":[31,20,-93,56,6], "armR":[33,17,-93,62,-5],
   "legL":[7,18,-98,31,6], "legR":[-31,15,-94,27,-35], "footL":[5,8,0], "footR":[4,32,0]},
  {"t":2.5,
   "hips":[-9,-1,96], "body":[13,-5,0], "chest":[0,19,0], "head":[-11,-18,0],
   "shL":[7,-3], "shR":[-6,-2], "armL":[29,19,-94,53,7], "armR":[28,17,-94,61,-4],
   "legL":[5,17,-98,20,4], "legR":[-31,14,-94,9,-42], "footL":[5,8,0], "footR":[4,32,0]}
]}
