{
"format": "2.0",
"id": "STYLE100/Waving_Walk",
"name": "Waving_Walk",
"legend": "2.0",
"dur": 1.467,
"loop": true,
"fps": 30,
"tags": ["walk","style","varies"],
"desc": "Waving at somebody else at random",
"skeleton": "humanoid",
"restSrc": "100STYLE",
"facts": {"by":"m3a-import@1","speed":81},
"provenance": {"src":"100STYLE","take":"Waving_FW 115.63-117.10","method":"captured","producer":{"tool":"m3a-import","version":"1"},"license":"CC-BY-4.0","credit":"100STYLE, Mason, Starke and Komura (CC BY 4.0)","ai":"digitalCapture"},
"quality": {"fit":[8,77],"qa":"unchecked","qaVersion":"none"},
"keys": [
  {"t":0,
   "hips":[0,0,100], "body":[3,-10,-2], "chest":[-1,22,2], "head":[3,9,-2],
   "shL":[5,-10], "shR":[5,-8], "armL":[23,8,-97,13,22], "armR":[74,29,-60,62,-46], "handL":[-8,-11,123], "handR":[-48,-3,130], "fingersL":[0,0,0,0,0], "fingersR":[0,0,0,0,0],
   "legL":[-26,-6,-97,13,3], "legR":[-29,1,-96,53,0], "footL":[10,4,0], "footR":[38,17,-1]},
  {"t":0.167,
   "hips":[-5,0,100], "body":[0,-8,-3], "chest":[1,21,3], "head":[4,10,-2],
   "shL":[6,-10], "shR":[5,-7], "armL":[31,9,-95,0,15], "armR":[81,19,-55,70,-36], "handL":[-13,-6,120], "handR":[-58,1,146], "fingersL":[0,0,0,0,0], "fingersR":[0,0,0,0,0],
   "legL":[-32,-4,-95,0,6], "legR":[4,0,-100,20,2], "footL":[9,2,0], "footR":[2,18,0]},
  {"t":0.233,
   "hips":[-6,0,99], "body":[0,-7,-3], "chest":[2,20,3], "head":[4,10,-2],
   "shL":[6,-9], "shR":[6,-8], "armL":[30,9,-95,3,25], "armR":[83,16,-53,75,-34], "handL":[-12,-7,130], "handR":[-60,6,155], "fingersL":[0,0,0,0,0], "fingersR":[0,0,0,0,0],
   "legL":[-35,-4,-94,0,4], "legR":[16,1,-99,0,-5], "footL":[9,2,0], "footR":[-13,10,0]},
  {"t":0.3,
   "hips":[-6,1,98], "body":[0,-7,-3], "chest":[3,20,4], "head":[4,9,-3],
   "shL":[6,-10], "shR":[6,-8], "armL":[27,7,-96,10,14], "armR":[86,17,-48,79,-37], "handL":[-10,-10,119], "handR":[-62,4,159], "fingersL":[0,0,0,0,0], "fingersR":[0,0,0,0,0],
   "legL":[-41,-3,-91,0,3], "legR":[20,1,-98,0,32], "footL":[10,3,0], "footR":[-20,4,0]},
  {"t":0.467,
   "hips":[-3,4,97], "body":[-1,-10,-2], "chest":[6,20,4], "head":[2,9,-4],
   "shL":[5,-10], "shR":[5,-8], "armL":[15,4,-99,3,7], "armR":[82,39,-43,84,-52], "handL":[-6,-9,113], "handR":[-65,-5,151], "fingersL":[0,0,0,0,0], "fingersR":[0,0,0,0,0],
   "legL":[-59,0,-81,16,-4], "legR":[8,-2,-100,8,23], "footL":[32,1,22], "footR":[0,-1,-1]},
  {"t":0.533,
   "hips":[-1,6,97], "body":[-1,-11,-2], "chest":[6,19,4], "head":[2,11,-4],
   "shL":[5,-10], "shR":[4,-8], "armL":[10,4,-99,13,10], "armR":[77,43,-46,85,-55], "handL":[-2,-14,114], "handR":[-65,-9,155], "fingersL":[0,0,0,0,0], "fingersR":[0,0,0,0,0],
   "legL":[-62,3,-78,33,-2], "legR":[0,-4,-100,16,23], "footL":[54,0,43], "footR":[6,-2,-1]},
  {"t":0.567,
   "hips":[0,7,98], "body":[-2,-11,-3], "chest":[6,18,5], "head":[3,12,-4],
   "shL":[5,-10], "shR":[4,-8], "armL":[7,3,-100,0,-4], "armR":[75,44,-49,85,-53], "handL":[-4,-8,100], "handR":[-66,-11,155], "fingersL":[0,0,0,0,0], "fingersR":[0,0,0,0,0],
   "legL":[-62,6,-78,39,-1], "legR":[-4,-6,-100,6,26], "footL":[60,161,36], "footR":[6,-2,-1]},
  {"t":0.633,
   "hips":[0,8,98], "body":[-2,-11,-2], "chest":[5,18,4], "head":[3,11,-3],
   "shL":[4,-9], "shR":[5,-8], "armL":[10,4,-99,8,10], "armR":[77,39,-50,85,-50], "handL":[0,-11,117], "handR":[-67,-12,157], "fingersL":[0,0,0,0,0], "fingersR":[0,0,0,0,0],
   "legL":[-58,5,-81,55,0], "legR":[-10,-6,-99,15,24], "footL":[46,166,-14], "footR":[7,-2,-1]},
  {"t":0.7,
   "hips":[0,9,99], "body":[-2,-11,-1], "chest":[4,18,3], "head":[4,12,-3],
   "shL":[4,-9], "shR":[5,-8], "armL":[14,5,-99,0,15], "armR":[81,28,-52,83,-42], "handL":[-4,-6,122], "handR":[-68,-9,156], "fingersL":[0,0,0,0,0], "fingersR":[0,0,0,0,0],
   "legL":[-51,3,-86,60,1], "legR":[-16,-5,-99,7,30], "footL":[49,111,-11], "footR":[7,-1,-1]},
  {"t":0.8,
   "hips":[-2,9,99], "body":[-2,-10,0], "chest":[2,19,3], "head":[5,11,-4],
   "shL":[5,-9], "shR":[7,-8], "armL":[25,3,-97,16,18], "armR":[87,23,-44,85,-38], "handL":[-6,-8,121], "handR":[-67,-6,170], "fingersL":[0,0,0,0,0], "fingersR":[1,1,1,1,1],
   "legL":[-27,0,-96,55,1], "legR":[-20,-4,-98,11,28], "footL":[36,43,12], "footR":[7,-1,-1]},
  {"t":0.9,
   "hips":[-3,9,99], "body":[-3,-8,0], "chest":[1,18,3], "head":[6,11,-4],
   "shL":[6,-9], "shR":[6,-7], "armL":[29,3,-96,19,20], "armR":[87,30,-38,88,-42], "handL":[-7,-6,122], "handR":[-70,-10,163], "fingersL":[0,0,0,0,0], "fingersR":[0,0,0,0,0],
   "legL":[1,-1,-100,32,3], "legR":[-24,-4,-97,6,33], "footL":[6,21,-1], "footR":[5,0,-1]},
  {"t":1,
   "hips":[-3,9,98], "body":[-1,-8,-1], "chest":[0,19,3], "head":[5,11,-3],
   "shL":[5,-10], "shR":[6,-6], "armL":[28,5,-96,22,18], "armR":[89,33,-33,88,-44], "handL":[-6,-8,119], "handR":[-72,-29,164], "fingersL":[0,0,0,0,0], "fingersR":[0,0,0,0,0],
   "legL":[15,2,-99,26,43], "legR":[-32,-5,-95,9,42], "footL":[-15,5,0], "footR":[6,-3,-1]},
  {"t":1.067,
   "hips":[-2,8,98], "body":[1,-8,-1], "chest":[-1,19,2], "head":[5,12,-2],
   "shL":[5,-10], "shR":[5,-7], "armL":[23,6,-97,12,18], "armR":[89,32,-34,87,-42], "handL":[-8,-6,119], "handR":[-68,-28,175], "fingersL":[0,0,0,0,0], "fingersR":[0,0,0,0,0],
   "legL":[12,2,-99,23,15], "legR":[-38,-3,-93,0,40], "footL":[-14,0,0], "footR":[9,-5,3]},
  {"t":1.167,
   "hips":[0,6,98], "body":[3,-10,-1], "chest":[-2,20,1], "head":[6,13,-1],
   "shL":[5,-10], "shR":[5,-8], "armL":[15,6,-99,0,6], "armR":[88,30,-37,88,-42], "handL":[-6,-7,106], "handR":[-66,-21,186], "fingersL":[0,0,0,0,0], "fingersR":[0,0,0,0,0],
   "legL":[2,0,-100,22,-4], "legR":[-47,0,-88,22,27], "footL":[3,5,0], "footR":[22,-8,17]},
  {"t":1.267,
   "hips":[2,3,99], "body":[4,-11,-1], "chest":[-2,20,1], "head":[6,13,-1],
   "shL":[4,-10], "shR":[5,-8], "armL":[11,5,-99,0,23], "armR":[86,33,-40,86,-49], "handL":[-1,-8,124], "handR":[-72,-28,171], "fingersL":[0,0,0,0,0], "fingersR":[0,0,0,0,0],
   "legL":[-11,-3,-99,19,-7], "legR":[-50,4,-87,40,11], "footL":[9,5,0], "footR":[50,-25,35]},
  {"t":1.333,
   "hips":[2,2,99], "body":[5,-11,-1], "chest":[-3,21,1], "head":[6,11,-2],
   "shL":[4,-10], "shR":[5,-8], "armL":[13,6,-99,12,16], "armR":[85,32,-42,84,-50], "handL":[-2,-10,118], "handR":[-76,-34,159], "fingersL":[0,0,0,0,0], "fingersR":[0,0,0,0,0],
   "legL":[-17,-5,-98,21,0], "legR":[-47,4,-88,53,5], "footL":[10,6,0], "footR":[60,-39,13]},
  {"t":1.4,
   "hips":[1,1,100], "body":[4,-10,-1], "chest":[-2,21,1], "head":[5,9,-2],
   "shL":[5,-10], "shR":[4,-8], "armL":[17,8,-98,4,20], "armR":[81,32,-50,75,-50], "handL":[-7,-7,121], "handR":[-67,-16,142], "fingersL":[0,0,0,0,0], "fingersR":[0,0,0,0,0],
   "legL":[-21,-6,-98,13,-1], "legR":[-39,2,-92,57,0], "footL":[9,5,0], "footR":[50,33,-2]},
  {"t":1.467,
   "hips":[0,0,100], "body":[3,-10,-2], "chest":[-1,22,2], "head":[3,9,-2],
   "shL":[5,-10], "shR":[5,-8], "armL":[23,8,-97,13,22], "armR":[74,29,-60,62,-46], "handL":[-8,-11,123], "handR":[-48,-3,130], "fingersL":[0,0,0,0,0], "fingersR":[0,0,0,0,0],
   "legL":[-26,-6,-97,13,3], "legR":[-29,1,-96,53,0], "footL":[10,4,0], "footR":[38,17,-1]}
]}
