{
"format": "2.0",
"id": "STYLE100_RUN/OnPhoneLeft_Run",
"name": "OnPhoneLeft_Run",
"legend": "2.0",
"dur": 0.733,
"loop": true,
"fps": 30,
"tags": ["run","style"],
"desc": "Running, on phone left style: holding phone in left",
"skeleton": "humanoid",
"restSrc": "100STYLE",
"facts": {"by":"m3a-import@1","speed":221},
"provenance": {"src":"100STYLE","take":"OnPhoneLeft_FR 7.62-8.35","method":"captured","producer":{"tool":"m3a-import","version":"1"},"license":"CC-BY-4.0","credit":"100STYLE, Mason, Starke and Komura (CC BY 4.0)","ai":"digitalCapture"},
"quality": {"fit":[9,80],"qa":"unchecked","qaVersion":"none"},
"keys": [
  {"t":0,
   "hips":[0,0,96], "body":[-6,-2,1], "chest":[0,19,0], "head":[3,10,0],
   "shL":[-1,-2], "shR":[2,-8], "armL":[41,-66,62,132,-3], "armR":[69,-12,-71,76,1], "handL":[-36,0,124], "handR":[-12,13,117], "fingersL":[0,0,0,0,0], "fingersR":[0,0,0,0,0],
   "legL":[-1,-13,-99,38,-3], "legR":[-53,-2,-85,81,-9], "footL":[4,-1,0], "footR":[42,-177,-23]},
  {"t":0.067,
   "hips":[-1,-1,96], "body":[-5,-2,1], "chest":[5,21,0], "head":[-1,7,-2],
   "shL":[-2,-2], "shR":[0,-10], "armL":[40,-64,65,134,0], "armR":[59,-3,-81,74,-4], "handL":[-37,-2,127], "handR":[-13,13,115], "fingersL":[0,0,0,0,0], "fingersR":[0,0,0,0,0],
   "legL":[-19,-12,-98,36,-7], "legR":[-33,1,-94,86,-9], "footL":[6,0,-1], "footR":[51,-227,-12]},
  {"t":0.1,
   "hips":[-1,-1,98], "body":[-3,-1,0], "chest":[6,20,0], "head":[-3,8,-2],
   "shL":[-2,-1], "shR":[0,-11], "armL":[41,-67,62,133,-4], "armR":[52,-2,-85,73,-6], "handL":[-38,-2,130], "handR":[-13,15,113], "fingersL":[0,0,0,0,0], "fingersR":[0,0,0,0,0],
   "legL":[-25,-10,-96,28,-5], "legR":[-16,1,-99,79,-7], "footL":[10,2,5], "footR":[51,-301,-2]},
  {"t":0.167,
   "hips":[0,-1,102], "body":[2,-1,0], "chest":[7,19,0], "head":[-6,11,-3],
   "shL":[-3,0], "shR":[-1,-11], "armL":[44,-64,63,132,-3], "armR":[42,1,-91,77,-9], "handL":[-39,-4,130], "handR":[-10,15,114], "fingersL":[0,0,0,0,0], "fingersR":[0,0,0,0,0],
   "legL":[-37,-9,-92,15,-1], "legR":[11,2,-99,56,-1], "footL":[34,-3,32], "footR":[25,-345,0]},
  {"t":0.233,
   "hips":[1,-1,105], "body":[5,-2,1], "chest":[8,22,-2], "head":[-9,10,-2],
   "shL":[-2,-1], "shR":[-4,-12], "armL":[43,-65,62,132,-9], "armR":[44,7,-90,77,-11], "handL":[-38,-4,127], "handR":[-5,16,118], "fingersL":[0,0,0,0,0], "fingersR":[0,0,0,0,0],
   "legL":[-47,-9,-88,9,1], "legR":[21,1,-98,34,-7], "footL":[51,-70,4], "footR":[5,-366,-1]},
  {"t":0.3,
   "hips":[2,0,103], "body":[5,-3,2], "chest":[7,22,-2], "head":[-8,11,-2],
   "shL":[0,0], "shR":[-1,-13], "armL":[45,-65,61,133,-9], "armR":[49,15,-86,75,-11], "handL":[-39,-4,127], "handR":[-5,15,117], "fingersL":[0,0,0,0,0], "fingersR":[0,0,0,0,0],
   "legL":[-52,-7,-85,32,0], "legR":[14,-3,-99,35,-8], "footL":[51,-111,-13], "footR":[13,-357,0]},
  {"t":0.333,
   "hips":[3,1,100], "body":[6,-3,3], "chest":[5,20,-2], "head":[-7,13,-2],
   "shL":[-3,1], "shR":[2,-12], "armL":[47,-62,62,134,-4], "armR":[49,17,-85,73,-10], "handL":[-39,-4,126], "handR":[-9,15,114], "fingersL":[0,0,0,0,0], "fingersR":[0,0,0,0,0],
   "legL":[-51,-8,-85,42,3], "legR":[5,-6,-100,42,-6], "footL":[55,-130,-12], "footR":[9,-347,0]},
  {"t":0.4,
   "hips":[1,1,98], "body":[5,-1,3], "chest":[2,20,0], "head":[-4,10,-6],
   "shL":[-4,0], "shR":[2,-12], "armL":[46,-62,63,134,-2], "armR":[65,19,-73,68,-11], "handL":[-42,-3,129], "handR":[-11,13,119], "fingersL":[0,0,0,0,0], "fingersR":[0,0,0,0,0],
   "legL":[-34,-5,-94,51,4], "legR":[-8,-6,-99,47,-2], "footL":[51,-289,35], "footR":[5,-343,0]},
  {"t":0.433,
   "hips":[0,1,98], "body":[5,-1,3], "chest":[-1,23,1], "head":[-3,7,-7],
   "shL":[-4,0], "shR":[3,-11], "armL":[42,-63,65,134,-1], "armR":[75,17,-63,73,-12], "handL":[-41,-1,128], "handR":[-12,13,119], "fingersL":[0,0,0,0,0], "fingersR":[0,0,0,0,0],
   "legL":[-24,-4,-97,50,4], "legR":[-16,-6,-99,48,-3], "footL":[41,-312,39], "footR":[6,-342,0]},
  {"t":0.5,
   "hips":[-2,1,100], "body":[1,1,3], "chest":[-1,21,0], "head":[-1,7,-4],
   "shL":[-3,0], "shR":[4,-10], "armL":[42,-65,63,131,-4], "armR":[85,0,-52,84,-6], "handL":[-40,-1,127], "handR":[-14,11,109], "fingersL":[0,0,0,0,0], "fingersR":[0,0,0,0,0],
   "legL":[4,-3,-100,41,-1], "legR":[-26,-6,-96,42,-2], "footL":[16,-342,12], "footR":[12,-336,6]},
  {"t":0.567,
   "hips":[-1,2,103], "body":[-3,2,3], "chest":[-1,18,-1], "head":[2,8,-1],
   "shL":[-4,-1], "shR":[5,-10], "armL":[43,-67,61,133,-6], "armR":[83,-22,-52,95,0], "handL":[-38,-1,123], "handR":[-13,11,115], "fingersL":[0,0,0,0,0], "fingersR":[0,0,0,0,0],
   "legL":[22,-5,-97,24,7], "legR":[-37,-7,-93,40,-10], "footL":[-3,-363,-2], "footR":[38,-329,33]},
  {"t":0.6,
   "hips":[0,2,103], "body":[-4,1,2], "chest":[-2,19,0], "head":[4,7,0],
   "shL":[-3,-1], "shR":[5,-9], "armL":[40,-68,61,133,-7], "armR":[80,-29,-53,99,3], "handL":[-37,-2,123], "handR":[-11,11,118], "fingersL":[1,1,1,1,1], "fingersR":[0,0,0,0,0],
   "legL":[24,-4,-97,26,21], "legR":[-44,-7,-89,45,-10], "footL":[-6,-371,-2], "footR":[56,-324,28]},
  {"t":0.633,
   "hips":[0,2,102], "body":[-4,0,1], "chest":[-3,19,0], "head":[4,8,1],
   "shL":[-1,-1], "shR":[4,-10], "armL":[42,-68,60,132,-8], "armR":[77,-31,-55,98,6], "handL":[-37,0,121], "handR":[-10,12,117], "fingersL":[1,1,1,1,1], "fingersR":[0,0,0,0,0],
   "legL":[23,-4,-97,28,23], "legR":[-49,-6,-87,54,-6], "footL":[-3,-373,-3], "footR":[55,-163,-7]},
  {"t":0.667,
   "hips":[1,2,100], "body":[-5,-1,0], "chest":[-2,19,0], "head":[3,9,2],
   "shL":[-1,0], "shR":[4,-10], "armL":[42,-70,59,132,-10], "armR":[74,-30,-60,94,5], "handL":[-35,0,121], "handR":[-9,11,119], "fingersL":[0,0,0,0,0], "fingersR":[0,0,0,0,0],
   "legL":[17,-6,-98,30,12], "legR":[-54,-7,-84,62,-6], "footL":[4,-369,-1], "footR":[45,-156,-26]},
  {"t":0.733,
   "hips":[0,0,96], "body":[-6,-2,1], "chest":[0,19,0], "head":[3,10,0],
   "shL":[-1,-2], "shR":[2,-8], "armL":[41,-66,62,132,-3], "armR":[69,-12,-71,76,1], "handL":[-36,0,124], "handR":[-12,13,117], "fingersL":[0,0,0,0,0], "fingersR":[0,0,0,0,0],
   "legL":[-1,-13,-99,38,-3], "legR":[-53,-2,-85,81,-9], "footL":[4,-361,0], "footR":[42,-177,-23]}
]}
