{
"format": "2.0",
"id": "MESH2MOTION/Bow",
"name": "Bow",
"legend": "2.0",
"dur": 3.75,
"loop": false,
"fps": 30,
"tags": ["bow","aim"],
"desc": "raises a bow from low to aim at head height, holds the aim, lowers it",
"skeleton": "humanoid",
"restSrc": "M2M_ANIMATED",
"contacts": {"by":"detected","footL":[[0,3.75]],"footR":[[0,3.75]]},
"facts": {"by":"m3a-facts@1","height":[100,100]},
"provenance": {"src":"M2M_ANIMATED","method":"keyed","producer":{"tool":"m3a-import","version":"1"},"license":"CC0-1.0","ai":"digitalCreation"},
"quality": {"fit":[10,134],"qa":"pass","qaVersion":"m3a-sensors@1"},
"keys": [
  {"t":0,
   "hips":[-5,0,100], "body":[0,0,0], "chest":[0,-13,0], "head":[0,18,0], "spine":[200,200,60],
   "shL":[0,0], "shR":[0,0], "armL":[81,-48,-34,117,-38], "armR":[54,-65,-54,107,61], "handL":[17,37,97], "handR":[-72,45,36], "fingersL":[86,86,86,86,86], "fingersR":[0,0,0,0,0],
   "legL":[-1,-3,-100,13,-1], "legR":[-1,-3,-100,13,2], "footL":[0,5,0], "footR":[0,5,0]},
  {"t":0.5,
   "hips":[-5,0,100], "body":[0,0,0], "chest":[0,-13,0], "head":[0,18,0], "spine":[200,200,60],
   "shL":[0,0], "shR":[0,0], "armL":[81,-47,-35,116,-38], "armR":[54,-64,-54,106,61], "handL":[16,38,98], "handR":[-71,45,35], "fingersL":[86,86,86,86,86], "fingersR":[0,0,0,0,0],
   "legL":[-1,-3,-100,13,-1], "legR":[-1,-3,-100,13,2], "footL":[0,5,0], "footR":[0,5,0]},
  {"t":0.667,
   "hips":[-5,0,100], "body":[0,0,0], "chest":[0,-12,0], "head":[0,18,0], "spine":[-100,-100,27],
   "shL":[0,0], "shR":[0,0], "armL":[83,-38,-41,101,-38], "armR":[61,-54,-58,91,59], "handL":[14,45,101], "handR":[-90,-45,204], "fingersL":[86,86,86,86,86], "fingersR":[2,2,2,2,2],
   "legL":[-1,-3,-100,13,-1], "legR":[-1,-3,-100,13,2], "footL":[0,5,0], "footR":[0,5,0]},
  {"t":0.867,
   "hips":[-5,0,100], "body":[0,0,0], "chest":[0,6,0], "head":[0,17,0], "spine":[-12,99,99],
   "shL":[0,0], "shR":[0,0], "armL":[90,-34,-27,95,-31], "armR":[75,-49,-46,81,50], "handL":[12,45,112], "handR":[-90,-45,214], "fingersL":[86,86,86,86,86], "fingersR":[1,1,1,1,1],
   "legL":[-1,-3,-100,13,-1], "legR":[-1,-3,-100,13,2], "footL":[0,5,0], "footR":[0,5,0]},
  {"t":1.033,
   "hips":[-5,0,100], "body":[0,0,0], "chest":[0,27,0], "head":[0,18,0], "spine":[-6,101,100],
   "shL":[0,0], "shR":[0,0], "armL":[93,-36,8,101,-23], "armR":[84,-51,-16,87,42], "handL":[17,45,116], "handR":[-53,45,49], "fingersL":[86,86,86,86,86], "fingersR":[0,0,0,0,0],
   "legL":[-1,-3,-100,13,-1], "legR":[-1,-3,-100,13,2], "footL":[0,5,0], "footR":[0,5,0]},
  {"t":1.167,
   "hips":[-5,0,100], "body":[0,0,0], "chest":[0,38,0], "head":[0,17,0], "spine":[-5,101,99],
   "shL":[0,0], "shR":[0,0], "armL":[89,-35,31,100,-18], "armR":[86,-51,6,87,39], "handL":[21,45,115], "handR":[-51,45,51], "fingersL":[86,86,86,86,86], "fingersR":[0,0,0,0,0],
   "legL":[-1,-3,-100,13,-1], "legR":[-1,-3,-100,13,2], "footL":[0,5,0], "footR":[0,5,0]},
  {"t":1.3,
   "hips":[-5,0,100], "body":[0,0,0], "chest":[0,42,0], "head":[0,18,0], "spine":[-4,101,100],
   "shL":[0,0], "shR":[0,0], "armL":[85,-33,40,97,-16], "armR":[85,-50,16,86,37], "handL":[22,45,114], "handR":[-49,45,52], "fingersL":[86,86,86,86,86], "fingersR":[0,0,0,0,0],
   "legL":[-1,-3,-100,13,-1], "legR":[-1,-3,-100,13,2], "footL":[0,5,0], "footR":[0,5,0]},
  {"t":1.833,
   "hips":[-5,0,100], "body":[0,0,0], "chest":[0,43,0], "head":[0,24,0], "spine":[-4,100,99],
   "shL":[0,0], "shR":[0,0], "armL":[84,-32,43,93,-20], "armR":[85,-48,21,82,38], "handL":[18,45,110], "handR":[-48,45,47], "fingersL":[86,86,86,86,86], "fingersR":[0,0,0,0,0],
   "legL":[-1,-3,-100,13,-1], "legR":[-1,-3,-100,13,2], "footL":[0,5,0], "footR":[0,5,0]},
  {"t":2,
   "hips":[-5,0,100], "body":[0,0,0], "chest":[0,42,0], "head":[0,24,0], "spine":[-4,101,99],
   "shL":[0,0], "shR":[0,0], "armL":[85,-33,42,94,-24], "armR":[85,-49,19,83,43], "handL":[16,45,108], "handR":[-50,45,42], "fingersL":[86,86,86,86,86], "fingersR":[0,0,0,0,0],
   "legL":[-1,-3,-100,13,-1], "legR":[-1,-3,-100,13,2], "footL":[0,5,0], "footR":[0,5,0]},
  {"t":2.167,
   "hips":[-5,0,100], "body":[0,0,0], "chest":[0,33,0], "head":[0,23,0], "spine":[-5,101,100],
   "shL":[0,0], "shR":[0,0], "armL":[88,-40,25,107,-29], "armR":[83,-56,-1,94,49], "handL":[16,45,108], "handR":[-59,45,47], "fingersL":[86,86,86,86,86], "fingersR":[0,0,0,0,0],
   "legL":[-1,-3,-100,13,-1], "legR":[-1,-3,-100,13,2], "footL":[0,5,0], "footR":[0,5,0]},
  {"t":2.4,
   "hips":[-5,0,100], "body":[0,0,0], "chest":[0,4,0], "head":[0,20,0], "spine":[-14,103,102],
   "shL":[0,0], "shR":[0,0], "armL":[86,-46,-22,115,-36], "armR":[66,-61,-44,102,56], "handL":[14,41,107], "handR":[-67,45,44], "fingersL":[86,86,86,86,86], "fingersR":[0,0,0,0,0],
   "legL":[-1,-3,-100,13,-1], "legR":[-1,-3,-100,13,2], "footL":[0,5,0], "footR":[0,5,0]},
  {"t":2.567,
   "hips":[-5,0,100], "body":[0,0,0], "chest":[0,-11,0], "head":[0,17,0], "spine":[-100,44,85],
   "shL":[0,0], "shR":[0,0], "armL":[82,-47,-33,117,-38], "armR":[55,-64,-53,106,61], "handL":[16,38,98], "handR":[-71,45,36], "fingersL":[86,86,86,86,86], "fingersR":[0,0,0,0,0],
   "legL":[-1,-3,-100,13,-1], "legR":[-1,-3,-100,13,2], "footL":[0,5,0], "footR":[0,5,0]},
  {"t":3.767,
   "hips":[-5,0,100], "body":[0,0,0], "chest":[0,-13,0], "head":[0,18,0], "spine":[200,200,60],
   "shL":[0,0], "shR":[0,0], "armL":[81,-48,-34,117,-38], "armR":[54,-65,-54,107,61], "handL":[17,37,97], "handR":[-72,45,36], "fingersL":[86,86,86,86,86], "fingersR":[0,0,0,0,0],
   "legL":[-1,-3,-100,13,-1], "legR":[-1,-3,-100,13,2], "footL":[0,5,0], "footR":[0,5,0]}
]}
